Avenue Supermarts Limited IPO,2017,08-Mar-17,10-Mar-17,BB,"1,870.00",299,641.6,1,114.58
CL Educate Ltd IPO,2017,20-Mar-17,22-Mar-17,BB,238.95,502,422.1,1,-15.92
Shankara Building Products Ltd IPO,2017,22-Mar-17,24-Mar-17,BB,345,460,632.45,1,37.49
S Chand and Company Ltd IPO,2017,26-Apr-17,28-Apr-17,BB,728.56,670,676,1,0.9
IRB InvIT Fund IPO,2017,03-May-17,05-May-17,BB,"5,921.10",102,101.8,1,-0.2
Housing and Urban Development Corporation Ltd IPO,2017,08-May-17,11-May-17,BB,"1,224.35",60,72.55,1,20.92
PSP Projects Ltd IPO,2017,17-May-17,19-May-17,BB,211.68,210,199.5,1,-5
IndiGrid InvIT Fund IPO,2017,17-May-17,19-May-17,BB,"2,250.00",100,98.64,1,-1.36
Tejas Networks Limited IPO,2017,14-Jun-17,16-Jun-17,BB,776.69,257,263.5,1,2.53
Eris Lifesciences Limited IPO,2017,16-Jun-17,20-Jun-17,BB,"1,741.16",603,601.5,1,-0.25
Central Depository Services (India) Limited IPO,2017,19-Jun-17,21-Jun-17,BB,523.99,149,261.6,1,75.57
GTPL Hathway Limited IPO,2017,21-Jun-17,23-Jun-17,BB,484.8,170,171.65,1,0.97
Au Financiers (India) Limited IPO,2017,28-Jun-17,30-Jun-17,BB,"1,912.51",358,541.65,1,51.3
Salasar Techno Engineering Ltd IPO,2017,12-Jul-17,17-Jul-17,FP,35.87,108,262.5,1,143.06
Security and Intelligence Services (India) Ltd IPO,2017,31-Jul-17,02-Aug-17,BB,779.58,815,757.05,1,-7.11
Cochin Shipyard Ltd IPO,2017,01-Aug-17,03-Aug-17,BB,"1,442.01",432,528.15,1,22.26
Apex Frozen Foods Ltd IPO,2017,22-Aug-17,24-Aug-17,BB,152.25,175,212.1,1,21.2
Bharat Road Network Limited IPO,2017,06-Sep-17,08-Sep-17,BB,600.65,205,208.45,1,1.68
Dixon Technologies (India) Limited IPO,2017,06-Sep-17,08-Sep-17,BB,600,"1,766.00",2891.55,1,63.73
Matrimony.com Limited IPO,2017,11-Sep-17,13-Sep-17,BB,496.88,985,904.65,1,-8.16
Capacit'e Infraprojects Limited IPO,2017,13-Sep-17,15-Sep-17,BB,400,250,342.55,1,37.02
ICICI Lombard General Insurance Company Ltd IPO,2017,15-Sep-17,19-Sep-17,BB,"5,700.94",661,681.2,1,3.06
SBI Life Insurance Company Ltd IPO,2017,20-Sep-17,22-Sep-17,BB,"8,400.00",700,707.55,1,1.08
Prataap Snacks Limited IPO,2017,22-Sep-17,26-Sep-17,BB,481.56,938,1180.65,1,25.87
Godrej Agrovet Limited IPO,2017,04-Oct-17,06-Oct-17,BB,"1,157.31",460,595.65,1,29.49
MAS Financial Services Ltd IPO,2017,06-Oct-17,10-Oct-17,BB,460.04,459,654.4,1,42.57
Indian Energy Exchange Ltd IPO,2017,09-Oct-17,11-Oct-17,BB,"1,000.73","1,650.00",1629.15,1,-1.26
General Insurance Corporation of India IPO,2017,11-Oct-17,13-Oct-17,BB,"11,175.84",912,874.3,1,-4.13
Reliance Nippon Life Asset Management Ltd IPO,2017,25-Oct-17,27-Oct-17,BB,"1,542.24",252,284.4,1,12.86
Mahindra Logistics Limited IPO,2017,31-Oct-17,02-Nov-17,BB,829.36,429,429.5,1,0.12
The New India Assurance Company Limited IPO,2017,01-Nov-17,03-Nov-17,BB,"9,600.00",800,727.1,1,-9.11
Khadim India Limited IPO,2017,02-Nov-17,06-Nov-17,BB,543.06,750,688.85,1,-8.15
HDFC Standard Life Insurance Company Ltd IPO,2017,07-Nov-17,09-Nov-17,BB,"8,695.01",290,344.6,1,18.83
Shalby Limited IPO,2017,05-Dec-17,07-Dec-17,BB,504.8,248,239.6,1,-3.39
Future Supply Chain Solutions Ltd IPO,2017,06-Dec-17,08-Dec-17,BB,649.7,664,686.35,1,3.37
Astron Paper & Board Mill Ltd IPO,2017,15-Dec-17,20-Dec-17,BB,70,50,120.75,1,141.5
Apollo Micro Systems Limited IPO,2018,10-Jan-18,12-Jan-18,BB,156,275,441.75,1,60.64
Newgen Software Technologies Limited IPO,2018,16-Jan-18,18-Jan-18,BB,424.62,245,252.4,1,3.02
Amber Enterprises India Limited IPO,2018,17-Jan-18,19-Jan-18,BB,600,859,1245.25,1,44.97
Galaxy Surfactants Limited IPO,2018,29-Jan-18,31-Jan-18,BB,937.09,"1,480.00",1700.45,1,14.9
Aster DM Healthcare Ltd IPO,2018,12-Feb-18,15-Feb-18,BB,980.14,190,181.55,1,-4.45
H.G. Infra Engineering Ltd IPO,2018,26-Feb-18,28-Feb-18,BB,462,270,267.75,1,-0.83
Bharat Dynamics Ltd IPO,2018,13-Mar-18,15-Mar-18,BB,960.94,428,389.8,1,-8.93
Bandhan Bank Limited IPO,2018,15-Mar-18,19-Mar-18,BB,"4,473.02",375,476.85,1,27.16
Hindustan Aeronautics Limited IPO,2018,16-Mar-18,20-Mar-18,BB,"4,144.06","1,215.00",1132.85,1,-6.76
Karda Construction Ltd IPO,2018,16-Mar-18,21-Mar-18,BB,77.4,180,142.8,1,-20.67
Sandhar Technologies Limited IPO,2018,19-Mar-18,21-Mar-18,BB,565.6,332,322.15,1,-2.97
Mishra Dhatu Nigam Limited IPO,2018,21-Mar-18,23-Mar-18,BB,438.38,90,90.05,1,0.06
ICICI Securities Ltd IPO,2018,22-Mar-18,26-Mar-18,BB,"4,016.97",520,445.1,1,-14.4
Lemon Tree Hotels Limited IPO,2018,26-Mar-18,28-Mar-18,BB,"1,038.68",56,71.65,1,27.95
IndoStar Capital Finance Limited IPO,2018,09-May-18,11-May-18,BB,"1,844.00",572,586.1,1,2.47
RITES Limited IPO,2018,20-Jun-18,22-Jun-18,BB,460.51,185,213.3,1,15.3
Fine Organic Industries Limited IPO,2018,20-Jun-18,22-Jun-18,BB,600.2,783,822.8,1,5.08
Varroc Engineering Limited IPO,2018,26-Jun-18,28-Jun-18,BB,"1,945.77",967,1037.35,1,7.28
TCNS Clothing Co. Limited IPO,2018,18-Jul-18,20-Jul-18,BB,"1,125.13",716,659.15,1,-7.94
HDFC Asset Management Company Limited IPO,2018,25-Jul-18,27-Jul-18,BB,"2,800.33","1,100.00",1815.95,1,65.09
CreditAccess Grameen Limited IPO,2018,08-Aug-18,10-Aug-18,BB,"1,131.19",422,422.05,1,0.01
IRCON International Limited IPO,2018,17-Sep-18,19-Sep-18,BB,470.49,475,415.3,1,-12.57
Garden Reach Shipbuilders & Engineers Limited IPO,2018,24-Sep-18,01-Oct-18,BB,344.69,118,103.3,1,-12.46
Aavas Financiers Limited IPO,2018,25-Sep-18,27-Sep-18,BB,"1,734.07",821,774.35,1,-5.68
Dinesh Engineers Limited IPO,2018,28-Sep-18,03-Oct-18,BB,,,,0,0
Chalet Hotels Limited IPO,2019,29-Jan-19,31-Jan-19,BB,"1,641.18",280,291.7,1,4.18
MSTC Limited IPO,2019,13-Mar-19,20-Mar-19,BB,212.04,120,113.95,1,-5.04
Rail Vikas Nigam Limited IPO,2019,29-Mar-19,03-Apr-19,BB,481.57,19,19.05,1,0.26
Metropolis Healthcare Limited IPO,2019,03-Apr-19,05-Apr-19,BB,"1,204.29",880,959.85,1,9.07
Polycab India Limited IPO,2019,05-Apr-19,09-Apr-19,BB,"1,346.00",538,654.8,1,21.71
Neogen Chemicals Limited IPO,2019,24-Apr-19,26-Apr-19,BB,132.35,215,263.55,1,22.58
IndiaMART InterMESH Limited IPO,2019,24-Jun-19,26-Jun-19,BB,475.59,973,1181,1,21.38
