Issuer Company,Year,Issue Open,Issue Close,Issue Type,Issue Size(Crore Rs.),Issue Price(Rs.),Listing Day Close Price (Rs.)ÿ,Status,Return
Autoline Industries Limited IPO,2007,08-Jan-07,12-Jan-07,BB,75,225,257.15,1,14.29
Akruti Nirman Limited IPO,2007,15-Jan-07,19-Jan-07,BB,361.8,540,563.45,1,4.34
Global Broadcast News Ltd IPO,2007,15-Jan-07,18-Jan-07,BB,105,250,505.9,1,102.36
Pochiraju Industries Limited IPO,2007,15-Jan-07,18-Jan-07,BB,37.6,30,49.65,1,65.5
Yogindera Worsted Limited IPO,2007,16-Jan-07,22-Jan-07,FP,,24,,0,0
House of Pearl Fashions Ltd IPO,2007,16-Jan-07,23-Jan-07,BB,329.17,550,469.95,1,-14.55
Technocraft Industries (India) Ltd IPO,2007,18-Jan-07,23-Jan-07,BB,87.36,105,100.05,1,-4.71
Cinemax India Ltd IPO,2007,18-Jan-07,24-Jan-07,BB,138.26,155,152.3,1,-1.74
Redington (India) Limited IPO,2007,22-Jan-07,25-Jan-07,BB,149.51,113,163.7,1,44.87
Transwarranty Finance Ltd IPO,2007,23-Jan-07,02-Feb-07,BB,31.2,52,47.45,1,-8.75
Firstsource Solutions Limited IPO,2007,29-Jan-07,02-Feb-07,BB,443.52,64,79.55,1,24.3
Power Finance Corporation Ltd. IPO,2007,31-Jan-07,06-Feb-07,BB,997.19,85,111.65,1,31.35
Indian Bank IPO,2007,05-Feb-07,09-Feb-07,BB,782.15,91,98.35,1,8.08
SMS Pharmaceuticals Limited IPO,2007,05-Feb-07,08-Feb-07,BB,97.93,380,359.25,1,-5.46
C & C Constructions Limited IPO,2007,05-Feb-07,09-Feb-07,BB,124.24,291,241.45,1,-17.03
Euro Ceramics Limited IPO,2007,07-Feb-07,13-Feb-07,BB,92.75,165,119.15,1,-27.79
Mudra Lifestyle Limited IPO,2007,08-Feb-07,14-Feb-07,BB,86.22,90,63.95,1,-28.94
Oriental Trimex Limited IPO,2007,08-Feb-07,14-Feb-07,BB,48,48,29.7,1,-38.13
MindTree Consulting Limited IPO,2007,09-Feb-07,14-Feb-07,BB,237.72,425,621.2,1,46.16
Broadcast Initiatives Limited IPO,2007,09-Feb-07,14-Feb-07,BB,102.6,120,70.4,1,-41.33
Indus Fila Limited IPO,2007,12-Feb-07,14-Feb-07,BB,82.34,170,133.85,1,-21.26
Evinix Accessories Limited IPO,2007,12-Feb-07,15-Feb-07,BB,42,120,74.05,1,-38.29
Idea Cellular Limited IPO,2007,12-Feb-07,15-Feb-07,BB,"2,125.00",75,85.7,1,14.27
Raj Television Network Ltd IPO,2007,14-Feb-07,23-Feb-07,BB,91.7,257,226,1,-12.06
Astral Poly Technik Limited IPO,2007,14-Feb-07,22-Feb-07,FP,34.17,115,105.35,1,-8.39
AMD Metplast Limited IPO,2007,15-Feb-07,23-Feb-07,BB,76.25,75,77.9,1,3.87
Abhishek Mills Ltd IPO,2007,20-Feb-07,01-Mar-07,BB,41,100,91.25,1,-8.75
Tubeknit Fashions Limited IPO,2007,21-Feb-07,02-Mar-07,BB,,,,0,0
Page Industries Ltd (Jockey India) IPO,2007,23-Feb-07,27-Feb-07,BB,100.94,360,271.8,1,-24.5
ICRA Limited IPO,2007,20-Mar-07,23-Mar-07,BB,85.18,330,803.25,1,143.41
Orbit Corporation Limited IPO,2007,20-Mar-07,23-Mar-07,BB,100.1,110,128.2,1,16.55
Advanta India Limited IPO,2007,26-Mar-07,30-Mar-07,BB,216.32,650,845.5,1,30.08
Ammana Bio Pharma Limited IPO,2007,28-Mar-07,05-Apr-07,BB,,,,0,0
Fortis Healthcare Ltd IPO,2007,16-Apr-07,20-Apr-07,BB,496.76,108,100.15,1,-7.27
Bhagwati Banquets And Hotels Ltd IPO,2007,18-Apr-07,25-Apr-07,BB,92,40,49.05,1,22.63
Hilton Metal Forging Ltd IPO,2007,18-Apr-07,24-Apr-07,FP,38.15,70,67.75,1,-3.21
MIC Electronics Limited IPO,2007,30-Apr-07,08-May-07,BB,76.5,150,338.15,1,125.43
Binani Cement Limited IPO,2007,07-May-07,10-May-07,BB,153.75,75,69.05,1,-7.93
Insecticides India Ltd IPO,2007,07-May-07,11-May-07,BB,36.92,115,109.45,1,-4.83
Glory Polyfilms Ltd IPO,2007,09-May-07,15-May-07,FP,39.46,48,62.1,1,29.38
Nitin Fire Protection Industries Ltd IPO,2007,15-May-07,18-May-07,BB,64.41,190,484.85,1,155.18
Time Technoplast Limited IPO,2007,18-May-07,23-May-07,BB,123.53,315,480.9,1,52.67
Decolight Ceramics Limited IPO,2007,24-May-07,29-May-07,BB,43.45,54,44.65,1,-17.31
Meghmani Organics Limited IPO,2007,04-Jun-07,07-Jun-07,BB,102,19,26.6,1,40
Nelcast Limited IPO,2007,04-Jun-07,08-Jun-07,BB,95.27,219,207.35,1,-5.32
Vishal Retail Ltd IPO,2007,11-Jun-07,13-Jun-07,BB,110,270,753.1,1,178.93
DLF Limited IPO,2007,11-Jun-07,14-Jun-07,BB,"9,187.50",525,569.8,1,8.53
Archidply Industries Ltd IPO,2007,11-Jun-07,17-Jun-08,BB,48.96,74,50.55,1,-31.69
Roman Tarmat Limited IPO,2007,12-Jun-07,19-Jun-07,BB,50.75,175,319.2,1,82.4
Celestial Labs Limited IPO,2007,18-Jun-07,22-Jun-07,FP,30,60,67.55,1,12.58
Housing Development and Infrastructure Ltd IPO,2007,28-Jun-07,03-Jul-07,BB,"1,485.00",500,559.35,1,11.87
Allied Digital Services Limited IPO,2007,02-Jul-07,05-Jul-07,BB,85.93,190,330.15,1,73.76
Everonn Systems India Limited IPO,2007,05-Jul-07,11-Jul-07,BB,50,140,477.35,1,240.96
Simplex Projects Limited IPO,2007,10-Jul-07,13-Jul-07,BB,55.5,185,273.7,1,47.95
Alpa Laboratories Limited IPO,2007,12-Jul-07,17-Jul-07,BB,64.6,68,55.15,1,-18.9
Omaxe Limited IPO,2007,17-Jul-07,20-Jul-07,BB,551.69,310,349.35,1,12.69
Omnitech InfoSolutions Limited IPO,2007,19-Jul-07,25-Jul-07,BB,35,105,163.4,1,55.62
Zylog Systems Limited IPO,2007,20-Jul-07,25-Jul-07,BB,126,350,427.5,1,22.14
IVR Prime Urban Developers Ltd IPO,2007,23-Jul-07,26-Jul-07,BB,778.25,550,417.9,1,-24.02
Central Bank of India IPO,2007,24-Jul-07,27-Jul-07,BB,816,102,115.3,1,13.04
Asian Granito India Ltd IPO,2007,26-Jul-07,31-Jul-07,BB,67.9,97,94.2,1,-2.89
SEL Manufacturing Company Ltd IPO,2007,26-Jul-07,31-Jul-07,BB,37.25,90,144.75,1,60.83
Puravankara Projects Limited IPO,2007,31-Jul-07,08-Aug-07,BB,858.7,400,362.3,1,-9.43
TAKE Solutions Limited IPO,2007,01-Aug-07,07-Aug-07,BB,153.3,730,927.8,1,27.1
K.P.R. Mill Limited IPO,2007,02-Aug-07,07-Aug-07,BB,133.02,225,174.2,1,-22.58
Motilal Oswal Financial Services Ltd IPO,2007,20-Aug-07,23-Aug-07,BB,246.07,825,976.85,1,18.41
Indowind Energy Limited IPO,2007,21-Aug-07,24-Aug-07,BB,81.25,65,113.65,1,74.85
Magnum Ventures Limited IPO,2007,27-Aug-07,30-Aug-07,BB,52.92,30,49.4,1,64.67
Kaveri Seed Company Limited IPO,2007,06-Sep-07,11-Sep-07,BB,68,170,230.95,1,35.85
Dhanus Technologies Limited IPO,2007,10-Sep-07,12-Sep-07,BB,113.13,295,309.75,1,5
Power Grid Corporation of India Ltd. IPO,2007,10-Sep-07,13-Sep-07,BB,"2,984.45",52,100.6,1,93.46
Koutons Retail India Limited IPO,2007,18-Sep-07,21-Sep-07,BB,146.26,415,586.5,1,41.33
Consolidated Construction Consortium Ltd IPO,2007,18-Sep-07,21-Sep-07,BB,188.7,510,792.1,1,55.31
Supreme Infrastructure India Ltd IPO,2007,21-Sep-07,26-Sep-07,BB,37.53,108,175.1,1,62.13
Maytas Infra Limited IPO,2007,27-Sep-07,04-Oct-07,BB,327.45,370,613.35,1,65.77
SVPCL Limited IPO,2007,22-Oct-07,26-Oct-07,BB,,,,0,0
Varun Industries Limited IPO,2007,25-Oct-07,31-Oct-07,FP,54,60,112.2,1,87
Barak Valley Cements Ltd IPO,2007,29-Oct-07,01-Nov-07,BB,23.77,42,55.3,1,31.67
Religare Enterprises Limited IPO,2007,29-Oct-07,01-Nov-07,BB,140.16,185,525.3,1,183.95
Mundra Port and Special Economic Zone Ltd IPO,2007,01-Nov-07,07-Nov-07,BB,"1,771.00",440,962.9,1,118.84
Empee Distilleries Limited IPO,2007,01-Nov-07,06-Nov-07,BB,192,400,319.35,1,-20.16
Edelweiss Capital Limited IPO,2007,15-Nov-07,20-Nov-07,BB,691.86,825,1510.25,1,83.06
Kolte-Patil Developers Limited IPO,2007,19-Nov-07,22-Nov-07,BB,275.51,145,181.35,1,25.07
Renaissance Jewellery Limited IPO,2007,19-Nov-07,21-Nov-07,BB,79.86,150,164.9,1,9.93
Kaushalya Infrastructure Dev Corp Ltd IPO,2007,20-Nov-07,23-Nov-07,BB,51,60,82.45,1,37.42
Jyothi Laboratories Limited IPO,2007,22-Nov-07,27-Nov-07,BB,305.69,690,741.15,1,7.41
Burnpur Cement Limited IPO,2007,28-Nov-07,03-Dec-07,FP,26.28,12,48.05,1,300.42
eClerx Services Limited IPO,2007,04-Dec-07,07-Dec-07,BB,101,315,449.65,1,42.75
BGR Energy Systems Limited IPO,2007,05-Dec-07,12-Dec-07,BB,438.53,480,901.45,1,87.8
Transformers and Rectifiers India Ltd IPO,2007,07-Dec-07,12-Dec-07,BB,139.27,465,729.25,1,56.83
Brigade Enterprises Limited IPO,2007,10-Dec-07,13-Dec-07,BB,648.36,390,379.9,1,-2.59
Aries Agro Limited IPO,2007,14-Dec-07,19-Dec-07,BB,58.5,130,251.4,1,93.38
Manaksia Limited IPO,2007,17-Dec-07,19-Dec-07,BB,248,160,167.7,1,4.81
Precision Pipes and Profiles Company Ltd IPO,2007,17-Dec-07,20-Dec-07,BB,75,150,136.1,1,-9.27
Future Capital Holdings Ltd IPO,2008,11-Jan-08,16-Jan-08,BB,491.34,765,909.8,1,18.93
Reliance Power Limited IPO,2008,15-Jan-08,18-Jan-08,BB,"11,563.20",450,372.3,1,-17.27
J Kumar Infraprojects Limited IPO,2008,18-Jan-08,23-Jan-08,BB,71.5,110,103.35,1,-6.05
Cords Cable Industries Limited IPO,2008,21-Jan-08,24-Jan-08,BB,41.65,135,139.45,1,3.3
OnMobile Global Limited IPO,2008,24-Jan-08,29-Jan-08,BB,479.62,440,518.15,1,17.76
KNR Constructions Limited IPO,2008,24-Jan-08,29-Jan-08,BB,133.87,180,154.9,1,-13.94
Bang Overseas Limited IPO,2008,28-Jan-08,31-Jan-08,BB,72.45,207,174.1,1,-15.89
Shriram EPC Limited IPO,2008,29-Jan-08,01-Feb-08,BB,150,300,286.5,1,-4.5
Wockhardt Hospitals Ltd IPO,2008,31-Jan-08,07-Feb-08,BB,,,,0,0
IRB Infrastructure Developers Ltd IPO,2008,31-Jan-08,05-Feb-08,BB,944.57,185,189.65,1,2.51
Emaar MGF Land Ltd IPO,2008,01-Feb-08,11-Feb-08,BB,,,,0,0
Tulsi Extrusions Limited IPO,2008,01-Feb-08,05-Feb-08,BB,48.45,85,140.85,1,65.71
SVEC Constructions Ltd IPO,2008,04-Feb-08,13-Feb-08,BB,,,,0,0
GSS America Infotech Ltd IPO,2008,11-Feb-08,15-Feb-08,BB,139.9,400,500.8,1,25.2
V-Guard Industries Limited IPO,2008,18-Feb-08,21-Feb-08,BB,65.6,82,75.95,1,-7.38
Rural Electrification Corporation Ltd. IPO,2008,19-Feb-08,22-Feb-08,BB,"1,639.26",105,121.3,1,15.52
Gammon Infrastructure Projects Ltd IPO,2008,10-Mar-08,13-Mar-08,BB,276.39,167,158.15,1,-5.3
Sita Shree Food Products Ltd IPO,2008,11-Mar-08,14-Mar-08,BB,31.5,30,43.7,1,45.67
Titagarh Wagons Limited IPO,2008,24-Mar-08,27-Mar-08,BB,128.72,540,706.85,1,30.9
Kiri Dyes and Chemicals Limited IPO,2008,25-Mar-08,02-Apr-08,BB,56.25,150,158.95,1,5.97
Gokul Refoils and Solvent Limited IPO,2008,08-May-08,13-May-08,BB,139.59,195,182.05,1,-6.64
Sejal Architectural Glass Ltd IPO,2008,09-Jun-08,12-Jun-08,BB,105.73,115,78.25,1,-31.96
First Winner Industries Limited IPO,2008,09-Jun-08,17-Jun-08,BB,68.75,125,89.2,1,-28.64
Lotus Eye Care Hospital Limited IPO,2008,12-Jun-08,20-Jun-08,BB,38,38,35.65,1,-6.18
KSK Energy Ventures Ltd IPO,2008,23-Jun-08,25-Jun-08,BB,830.66,240,191.75,1,-20.1
Birla Cotsyn (India) Limited IPO,2008,30-Jun-08,09-Jul-08,BB,144.18,14,9.45,1,-32.5
Vishal Information Technologies Ltd IPO,2008,21-Jul-08,24-Jul-08,BB,41.85,150,194.6,1,29.73
Nu Tek India Limited IPO,2008,29-Jul-08,01-Aug-08,BB,86.4,192,199.15,1,3.72
Austral Coke & Projects Ltd IPO,2008,07-Aug-08,13-Aug-08,BB,142.3,196,225.95,1,15.28
Resurgere Mines & Minerals India Ltd IPO,2008,11-Aug-08,13-Aug-08,BB,120.15,270,533.55,1,97.61
20 Microns Limited IPO,2008,08-Sep-08,11-Sep-08,BB,23.93,55,33.65,1,-38.82
Alkali Metals Limited IPO,2008,07-Oct-08,15-Oct-08,BB,26.27,103,173.4,1,68.35
Gemini Engi-Fab Limited IPO,2009,03-Feb-09,06-Feb-09,BB,,,,0,0
Edserv Softsystems Limited IPO,2009,05-Feb-09,09-Feb-09,BB,23.84,60,136.4,1,127.33
Mahindra Holidays and Resorts India Ltd IPO,2009,23-Jun-09,26-Jun-09,BB,277.96,300,317.45,1,5.82
Excel Infoways Limited IPO,2009,14-Jul-09,17-Jul-09,BB,48.17,85,95.85,1,12.76
Raj Oil Mills Limited IPO,2009,20-Jul-09,23-Jul-09,BB,114,120,119.25,1,-0.63
Adani Power Limited IPO,2009,28-Jul-09,31-Jul-09,BB,"3,016.52",100,100.1,1,0.1
NHPC Limited IPO,2009,07-Aug-09,12-Aug-09,BB,"6,038.55",36,36.75,1,2.08
Jindal Cotex Limited IPO,2009,27-Aug-09,01-Sep-09,BB,84.38,75,87.3,1,16.4
Globus Spirits Limited IPO,2009,31-Aug-09,02-Sep-09,BB,75,100,91,1,-9
Oil India Limited IPO,2009,07-Sep-09,10-Sep-09,BB,"2,777.25","1,050.00",1141.2,1,8.69
Pipavav Shipyard Limited IPO,2009,16-Sep-09,18-Sep-09,BB,495.61,58,56.7,1,-2.24
Euro Multivision Limited IPO,2009,22-Sep-09,24-Sep-09,BB,66,75,53.55,1,-28.6
Thinksoft Global Services Ltd IPO,2009,22-Sep-09,01-Oct-09,BB,45.58,125,164.4,1,31.52
Indiabulls Power Limited IPO,2009,12-Oct-09,15-Oct-09,BB,"1,529.10",45,39.5,1,-12.22
Den Networks Limited IPO,2009,28-Oct-09,30-Oct-09,BB,364.46,195,163.4,1,-16.21
Astec LifeSciences Limited IPO,2009,29-Oct-09,04-Nov-09,BB,61.5,82,84,1,2.44
Cox and Kings (India) Limited IPO,2009,18-Nov-09,20-Nov-09,BB,610.39,330,425.4,1,28.91
MBL Infrastructures Ltd IPO,2009,27-Nov-09,01-Dec-09,BB,102.6,180,206.55,1,14.75
JSW Energy Limited IPO,2009,07-Dec-09,09-Dec-09,BB,"2,700.00",95,100.85,1,6.16
Godrej Properties Limited IPO,2009,09-Dec-09,11-Dec-09,BB,468.85,490,537.25,1,9.64
D B Corp Limited IPO,2009,11-Dec-09,15-Dec-09,BB,384.22,212,265.9,1,25.42
Infinite Computer Solutions India Ltd IPO,2010,11-Jan-10,13-Jan-10,BB,189.8,165,191.8,1,16.24
Jubilant Foodworks Ltd IPO,2010,18-Jan-10,20-Jan-10,BB,328.72,145,229.1,1,58
Aqua Logistics Ltd IPO,2010,25-Jan-10,02-Feb-10,BB,150,215,244.6,1,13.77
Thangamayil Jewellery Limited IPO,2010,27-Jan-10,29-Jan-10,BB,28.76,75,71.05,1,-5.27
Syncom Healthcare Limited IPO,2010,27-Jan-10,29-Jan-10,BB,56.25,75,87.75,1,17
Vascon Engineers Limited IPO,2010,27-Jan-10,29-Jan-10,BB,178.2,165,148.05,1,-10.27
D B Realty Limited IPO,2010,29-Jan-10,02-Feb-10,BB,"1,500.00",468,456.2,1,-2.52
Emmbi Polyarns Limited IPO,2010,01-Feb-10,03-Feb-10,BB,38.96,45,28.75,1,-36.11
ARSS Infrastructure Projects Ltd IPO,2010,08-Feb-10,11-Feb-10,BB,103,450,737.45,1,63.88
Hathway Cable & Datacom Ltd IPO,2010,09-Feb-10,11-Feb-10,BB,666,240,207.65,1,-13.48
Texmo Pipes & Products Ltd IPO,2010,16-Feb-10,19-Feb-10,BB,45,90,137.15,1,52.39
Man Infraconstruction Ltd IPO,2010,18-Feb-10,22-Feb-10,BB,141.75,252,349.85,1,38.83
United Bank of India IPO,2010,23-Feb-10,25-Feb-10,BB,324.98,66,68.65,1,4.02
Pradip Overseas Limited IPO,2010,11-Mar-10,15-Mar-10,BB,116.6,110,107.05,1,-2.68
IL&FS Transportation Networks Ltd IPO,2010,11-Mar-10,15-Mar-10,BB,700,258,274.65,1,6.45
Persistent Systems Limited IPO,2010,17-Mar-10,19-Mar-10,BB,168.01,310,406.35,1,31.08
Shree Ganesh Jewellery House Ltd IPO,2010,19-Mar-10,23-Mar-10,BB,371.02,260,164.55,1,-36.71
Goenka Diamond & Jewels Ltd IPO,2010,23-Mar-10,26-Mar-10,BB,126.51,135,127.6,1,-5.48
Talwalkars Better value Fitness Ltd IPO,2010,21-Apr-10,23-Apr-10,BB,77.44,128,163.15,1,27.46
Nitesh Estates Limited IPO,2010,23-Apr-10,27-Apr-10,BB,405,54,51.4,1,-4.81
Tarapur Transformers Limited IPO,2010,26-Apr-10,28-Apr-10,BB,63.75,75,57.4,1,-23.47
Mandhana Industries Limited IPO,2010,27-Apr-10,29-Apr-10,BB,107.9,130,133.55,1,2.73
Tara Health Foods Limited IPO,2010,28-Apr-10,30-Apr-10,BB,,0,,0,0
SJVN Ltd (Satluj Jal Vidyut Nigam Ltd) IPO,2010,29-Apr-10,03-May-10,BB,"1,062.74",26,25.1,1,-3.46
Jaypee Infratech Ltd IPO,2010,29-Apr-10,04-May-10,BB,"1,650.00",102,91.45,1,-10.34
Fatpipe Networks India Limited IPO,2010,07-Jun-10,09-Jun-10,BB,,,,0,0
Parabolic Drugs Limited IPO,2010,14-Jun-10,17-Jun-10,BB,200,75,64.85,1,-13.53
Aster Silicates Ltd IPO,2010,24-Jun-10,28-Jun-10,BB,53.1,118,205.55,1,74.19
Technofab Engineering Ltd IPO,2010,29-Jun-10,02-Jul-10,BB,71.66,240,296.95,1,23.73
Hindustan Media Ventures Ltd IPO,2010,05-Jul-10,07-Jul-10,BB,270,166,188.95,1,13.83
SKS Microfinance Ltd IPO,2010,28-Jul-10,02-Aug-10,BB,"1,628.78",985,1088.65,1,10.52
Bajaj Corp Limited IPO,2010,02-Aug-10,05-Aug-10,BB,297,660,758.75,1,14.96
Prakash Steelage Ltd IPO,2010,05-Aug-10,10-Aug-10,BB,68.75,110,185.35,1,68.5
Gujarat Pipavav Port Ltd (GPPL) IPO,2010,23-Aug-10,26-Aug-10,BB,500,46,54.05,1,17.5
Indosolar Ltd IPO,2010,13-Sep-10,15-Sep-10,BB,357,29,23.7,1,-18.28
Career Point Infosystems Ltd IPO,2010,16-Sep-10,21-Sep-10,BB,115,310,628.15,1,102.63
Microsec Financial Services Ltd IPO,2010,17-Sep-10,21-Sep-10,BB,147.5,118,111.35,1,-5.64
Eros International Media Ltd IPO,2010,17-Sep-10,21-Sep-10,BB,350,175,190.25,1,8.71
Ramky Infrastructure Ltd IPO,2010,21-Sep-10,23-Sep-10,BB,530,450,387.4,1,-13.91
Orient Green Power Company Ltd IPO,2010,21-Sep-10,24-Sep-10,BB,900,47,44.7,1,-4.89
Electrosteel Integrated Ltd IPO,2010,21-Sep-10,24-Sep-10,BB,248.07,11,11.25,1,2.27
Gallantt Ispat Ltd IPO,2010,22-Sep-10,24-Sep-10,FP,40.5,50,81.05,1,62.1
VA Tech Wabag Ltd IPO,2010,22-Sep-10,27-Sep-10,BB,125,"1,310.00",1707.95,1,30.38
Cantabil Retail India Ltd IPO,2010,22-Sep-10,27-Sep-10,BB,105,135,105,1,-22.22
Tecpro Systems Ltd IPO,2010,23-Sep-10,28-Sep-10,BB,267.91,355,405.7,1,14.28
Ashoka Buildcon Ltd IPO,2010,24-Sep-10,28-Sep-10,BB,225,324,330.75,1,2.08
Bedmutha Industries Ltd IPO,2010,28-Sep-10,01-Oct-10,BB,91.8,102,179.15,1,75.64
Commercial Engineers & Body Builders Co Ltd IPO,2010,30-Sep-10,05-Oct-10,BB,153,127,112.9,1,-11.1
Oberoi Realty Ltd IPO,2010,06-Oct-10,08-Oct-10,BB,"1,028.61",260,282.9,1,8.81
BS Transcomm Ltd IPO,2010,06-Oct-10,13-Oct-10,BB,190.45,248,381.25,1,53.73
Prestige Estates Projects Ltd IPO,2010,12-Oct-10,14-Oct-10,BB,"1,200.00",183,193.15,1,5.55
Gyscoal Alloys Ltd IPO,2010,13-Oct-10,15-Oct-10,BB,54.67,71,81.65,1,15
Coal India Limited IPO,2010,18-Oct-10,21-Oct-10,BB,"15,199.44",245,342.55,1,39.82
Gravita India Ltd IPO,2010,01-Nov-10,03-Nov-10,BB,45,125,209.7,1,67.76
RPP Infra Projects Ltd IPO,2010,18-Nov-10,22-Nov-10,BB,48.75,75,68.9,1,-8.13
MOIL Limited IPO,2010,26-Nov-10,01-Dec-10,BB,"1,237.51",375,465.05,1,24.01
Ravi Kumar Distilleries Ltd IPO,2010,08-Dec-10,10-Dec-10,BB,73.6,64,80.05,1,25.08
A2Z Maintenance & Engineering Services Ltd IPO,2010,08-Dec-10,10-Dec-10,BB,675,400,328.55,1,-17.86
Punjab & Sind Bank IPO,2010,13-Dec-10,16-Dec-10,BB,470.82,120,127.15,1,5.96
Shekhawati Poly-Yarn Ltd IPO,2010,27-Dec-10,29-Dec-10,FP,36,30,47.5,1,58.33
C Mahendra Exports Ltd IPO,2010,31-Dec-10,06-Jan-11,BB,165,110,110.75,1,0.68
Omkar Speciality Chemicals Ltd IPO,2011,24-Jan-11,27-Jan-11,BB,79.38,98,46.45,1,-52.6
Sudar Garments Ltd IPO,2011,21-Feb-11,24-Feb-11,BB,69.98,77,113.1,1,46.88
Acropetal Technologies Ltd IPO,2011,21-Feb-11,24-Feb-11,BB,170,90,98.45,1,9.39
Lovable Lingeries Ltd IPO,2011,08-Mar-11,11-Mar-11,BB,93.28,205,249.55,1,21.73
PTC India Financial Services Ltd IPO,2011,16-Mar-11,18-Mar-11,BB,438.76,28,24.9,1,-11.07
Shilpi Cable Technologies Ltd IPO,2011,22-Mar-11,25-Mar-11,BB,55.88,69,48.05,1,-30.36
Muthoot Finance Ltd IPO,2011,18-Apr-11,21-Apr-11,BB,901.25,175,175.9,1,0.51
Paramount Printpackaging Ltd IPO,2011,20-Apr-11,25-Apr-11,BB,45.83,35,27.05,1,-22.71
Future Ventures India Ltd IPO,2011,25-Apr-11,28-Apr-11,BB,750,10,8.2,1,-18
Innoventive Industries Ltd IPO,2011,26-Apr-11,29-Apr-11,BB,219.58,117,94.05,1,-19.62
Servalakshmi Paper Ltd IPO,2011,27-Apr-11,29-Apr-11,BB,60,29,19.05,1,-34.31
Vaswani Industries Ltd IPO,2011,29-Apr-11,03-May-11,BB,49,49,18.4,1,-62.45
Sanghvi Forging & Engineering Ltd IPO,2011,04-May-11,09-May-11,BB,36.9,85,112,1,31.76
Aanjaneya Lifecare Ltd IPO,2011,09-May-11,12-May-11,BB,117,234,311.1,1,32.95
Galaxy Surfactants Ltd IPO,2011,13-May-11,19-May-11,BB,,0,,0,0
Timbor Home Limited IPO,2011,30-May-11,02-Jun-11,BB,23.25,63,91.55,1,45.32
Rushil Decor Ltd IPO,2011,20-Jun-11,23-Jun-11,BB,40.64,72,119.5,1,65.97
Bharatiya Global Infomedia Ltd IPO,2011,11-Jul-11,14-Jul-11,BB,55.1,82,29.9,1,-63.54
Inventure Growth & Securities Ltd IPO,2011,20-Jul-11,22-Jul-11,BB,81.9,117,206.75,1,76.71
L&T Finance Holdings Limited IPO,2011,27-Jul-11,29-Jul-11,BB,"1,245.00",52,50.05,1,-3.75
Tree House Education & Accessories Ltd IPO,2011,10-Aug-11,12-Aug-11,BB,113.83,135,117.6,1,-12.89
Brooks Laboratories Ltd IPO,2011,16-Aug-11,18-Aug-11,BB,63,100,61.5,1,-38.5
SRS Limited IPO,2011,23-Aug-11,26-Aug-11,BB,203,58,33.25,1,-42.67
TD Power Systems Ltd IPO,2011,24-Aug-11,26-Aug-11,BB,227,256,275.25,1,7.52
PG Electroplast Limited IPO,2011,07-Sep-11,12-Sep-11,BB,120.65,210,415.3,1,97.76
Prakash Constrowell Ltd IPO,2011,19-Sep-11,21-Sep-11,BB,60,138,230,1,66.67
Swajas Air Charters Ltd IPO,2011,26-Sep-11,05-Oct-11,BB,,90,,0,0
Tijaria Polypipes Ltd IPO,2011,27-Sep-11,29-Sep-11,FP,60,60,18.6,1,-69
M and B Switchgears Ltd IPO,2011,28-Sep-11,05-Oct-11,BB,93,186,318.4,1,71.18
Onelife Capital Advisors Ltd IPO,2011,28-Sep-11,04-Oct-11,BB,36.85,110,145.95,1,32.68
Flexituff International Ltd IPO,2011,29-Sep-11,05-Oct-11,BB,104.63,155,165.55,1,6.81
Taksheel Solutions Ltd IPO,2011,29-Sep-11,04-Oct-11,BB,82.5,150,58.15,1,-61.23
Indo Thai Securities Limited IPO,2011,30-Sep-11,05-Oct-11,BB,29.6,74,23.15,1,-68.72
Goodwill Hospital & Research Centre Ltd IPO,2011,30-Dec-11,09-Jan-12,BB,,,,0,0
Multi Commodity Exchange of India Ltd IPO,2012,22-Feb-12,24-Feb-12,BB,663.31,"1,032.00",1296.7,1,25.65
National Buildings Construction Corporation Ltd IPO,2012,22-Mar-12,27-Mar-12,BB,127.2,106,96.95,1,-8.54
MT Educare Limited IPO,2012,27-Mar-12,29-Mar-12,BB,99,80,90.35,1,12.94
Tribhovandas Bhimji Zaveri Ltd IPO,2012,24-Apr-12,26-Apr-12,BB,200,120,111,1,-7.5
Samvardhana Motherson Finance Ltd IPO,2012,02-May-12,04-May-12,BB,,,,0,0
Plastene India Limited IPO,2012,09-May-12,15-May-12,BB,,,,0,0
Speciality Restaurants Ltd IPO,2012,16-May-12,18-May-12,BB,176.09,150,159.6,1,6.4
VKS Projects Ltd IPO,2012,29-Jun-12,04-Jul-12,BB,55,55,55,1,0
Tara Jewels Limited IPO,2012,21-Nov-12,23-Nov-12,BB,183.49,230,229.9,1,-0.04
Credit Analysis & Research Ltd IPO,2012,07-Dec-12,11-Dec-12,BB,539.98,750,922.55,1,23.01
PC Jeweller Ltd IPO,2012,10-Dec-12,12-Dec-12,BB,609.3,135,149.2,1,10.52
Bharti Infratel Limited IPO,2012,11-Dec-12,14-Dec-12,BB,"4,155.80",220,191.65,1,-12.89
V-Mart Retail Ltd IPO,2013,01-Feb-13,05-Feb-13,BB,94.42,210,203.3,1,-3.19
Sai Silks (Kalamandir) Ltd IPO,2013,11-Feb-13,13-Feb-13,BB,,,,0,0
Repco Home Finance Ltd IPO,2013,13-Mar-13,15-Mar-13,BB,270.39,172,161.8,1,-5.93
Scotts Garments Ltd IPO,2013,25-Apr-13,03-May-13,BB,,,,0,0
Just Dial Ltd IPO,2013,20-May-13,22-May-13,BB,919.14,530,612.35,1,15.54
Loha Ispaat Ltd IPO,2014,11-Mar-14,25-Mar-14,BB,,,,0,0
Wonderla Holidays Ltd IPO,2014,21-Apr-14,23-Apr-14,BB,181.25,125,157.8,1,26.24
Snowman Logistics Ltd IPO,2014,26-Aug-14,28-Aug-14,BB,197.4,47,79.8,1,69.79
Sharda Cropchem Ltd IPO,2014,05-Sep-14,09-Sep-14,BB,351.86,156,230.95,1,48.04
Shemaroo Entertainment Ltd IPO,2014,16-Sep-14,18-Sep-14,BB,120,170,171,1,0.59
Monte Carlo Fashions Limited IPO,2014,03-Dec-14,05-Dec-14,BB,350.43,645,567.3,1,-12.05
NCML Industries Ltd IPO,2014,29-Dec-14,09-Jan-15,BB,,,,0,0
Ortel Communications Ltd IPO,2015,03-Mar-15,05-Mar-15,BB,66.11,181,162.25,1,-10.36
Adlabs Entertainment Ltd IPO,2015,10-Mar-15,12-Mar-15,BB,365.87,180,191.5,1,6.39
Inox Wind Limited IPO,2015,18-Mar-15,20-Mar-15,BB,"1,020.52",325,438.4,1,34.89
VRL Logistics Ltd IPO,2015,15-Apr-15,17-Apr-15,BB,473.88,205,294.1,1,43.46
MEP Infrastructure Developers Ltd IPO,2015,21-Apr-15,23-Apr-15,BB,324,63,58.4,1,-7.3
UFO Moviez Ltd IPO,2015,28-Apr-15,30-Apr-15,BB,600,625,597.3,1,-4.43
PNC Infratech Limited IPO,2015,08-May-15,12-May-15,BB,488.44,378,360.5,1,-4.63
Manpasand Beverages Ltd IPO,2015,24-Jun-15,26-Jun-15,BB,400,320,327.75,1,2.42
Syngene International Ltd IPO,2015,27-Jul-15,29-Jul-15,BB,550,250,310.55,1,24.22
Power Mech Projects Ltd IPO,2015,07-Aug-15,11-Aug-15,BB,273.22,640,580,1,-9.38
Navkar Corporation Limited IPO,2015,24-Aug-15,26-Aug-15,BB,600,155,166.85,1,7.65
Shree Pushkar Chemicals and Fertilisers Ltd IPO,2015,25-Aug-15,27-Aug-15,BB,70,65,63.05,1,-3
Pennar Engineered Building Systems Ltd IPO,2015,25-Aug-15,27-Aug-15,BB,156.19,178,169.5,1,-4.78
Prabhat Dairy Limited IPO,2015,28-Aug-15,04-Sep-15,BB,356.19,115,115.95,1,0.83
Sadbhav Infrastructure Project Limited IPO,2015,31-Aug-15,02-Sep-15,BB,491.66,103,106.2,1,3.11
Coffee Day Enterprises Ltd IPO,2015,14-Oct-15,16-Oct-15,BB,"1,150.00",328,271,1,-17.38
InterGlobe Aviation Ltd IPO,2015,27-Oct-15,29-Oct-15,BB,"3,018.24",765,877.25,1,14.67
S H Kelkar & Company Ltd IPO,2015,28-Oct-15,30-Oct-15,BB,508.17,180,209.85,1,16.58
Dr. Lal PathLabs Limited IPO,2015,08-Dec-15,10-Dec-15,BB,638,550,825,1,50
Alkem Laboratories Limited IPO,2015,08-Dec-15,10-Dec-15,BB,"1,349.61","1,050.00",1381.7,1,31.59
Narayana Hrudayalaya Ltd IPO,2015,17-Dec-15,21-Dec-15,BB,613.08,250,336.95,1,34.78
Precision Camshafts Ltd IPO,2016,27-Jan-16,29-Jan-16,BB,410,186,177.45,1,-4.6
TeamLease Services Ltd IPO,2016,02-Feb-16,04-Feb-16,BB,423.68,850,1032,1,21.41
Quick Heal Technologies Ltd IPO,2016,08-Feb-16,10-Feb-16,BB,451.25,321,253.85,1,-20.92
Healthcare Global Enterprises Ltd IPO,2016,16-Mar-16,18-Mar-16,BB,649.64,218,171,1,-21.56
Bharat Wire Ropes Ltd IPO,2016,18-Mar-16,22-Mar-16,BB,70,45,45.55,1,1.22
Infibeam Incorporation Ltd IPO,2016,21-Mar-16,23-Mar-16,BB,450,432,445.75,1,3.18
Equitas Holdings Limited IPO,2016,05-Apr-16,07-Apr-16,BB,"2,175.00",110,135.2,1,22.91
Thyrocare Technologies Ltd IPO,2016,27-Apr-16,29-Apr-16,BB,479.21,446,618.8,1,38.74
Ujjivan Financial Services Ltd IPO,2016,28-Apr-16,02-May-16,BB,887.69,210,231.55,1,10.26
Parag Milk Foods Ltd IPO,2016,04-May-16,11-May-16,BB,751.78,215,247,1,14.88
Mahanagar Gas Limited IPO,2016,21-Jun-16,23-Jun-16,BB,"1,039.64",421,520.3,1,23.59
Quess Corp Ltd IPO,2016,29-Jun-16,01-Jul-16,BB,400,317,503.1,1,58.71
L&T Infotech Ltd IPO,2016,11-Jul-16,13-Jul-16,BB,"1,236.00",710,697.6,1,-1.75
Advanced Enzyme Technologies Ltd IPO,2016,20-Jul-16,22-Jul-16,BB,411.49,896,1178.1,1,31.48
Dilip Buildcon Ltd IPO,2016,01-Aug-16,03-Aug-16,BB,653.98,219,251.75,1,14.95
S P Apparels Ltd IPO,2016,02-Aug-16,04-Aug-16,BB,239.12,268,288.75,1,7.74
RBL Bank Ltd IPO,2016,19-Aug-16,23-Aug-16,BB,"1,212.97",225,299.4,1,33.07
L&T Technology Services Ltd IPO,2016,12-Sep-16,15-Sep-16,BB,894.4,860,869,1,1.05
G N A Axles Ltd IPO,2016,14-Sep-16,16-Sep-16,BB,130.41,207,245.05,1,18.38
ICICI Prudential Life Insurance Company Ltd IPO,2016,19-Sep-16,21-Sep-16,BB,"6,056.79",334,297.55,1,-10.91
HPL Electric & Power Ltd IPO,2016,22-Sep-16,26-Sep-16,BB,361,202,189.3,1,-6.29
Endurance Technologies Ltd IPO,2016,05-Oct-16,07-Oct-16,BB,"1,161.73",472,646.9,1,37.06
PNB Housing Finance Ltd IPO,2016,25-Oct-16,27-Oct-16,BB,"3,000.75",775,891.15,1,14.99
Varun Beverages Ltd IPO,2016,26-Oct-16,28-Oct-16,BB,"1,112.50",445,459.5,1,3.26
GreenSignal Bio Pharma Ltd IPO,2016,09-Nov-16,22-Nov-16,BB,,,,0,0
Sheela Foam Ltd IPO,2016,29-Nov-16,01-Dec-16,BB,510,730,1032,1,41.37
Laurus Labs Ltd IPO,2016,06-Dec-16,08-Dec-16,BB,"1,331.80",428,480.4,1,12.24
BSE Limited IPO,2017,23-Jan-17,25-Jan-17,BB,"1,243.43",806,1069.2,1,32.66
Music Broadcast Ltd IPO,2017,06-Mar-17,08-Mar-17,BB,488.53,333,372.9,1,11.98
